{
  "$schema": "https://dopejs.dev/schemas/m0-evidence-manifest-v1.json",
  "version": 1,
  "buildId": "formal-build-abc123",
  "businessAudit": {
    "artifact": {
      "path": "evidence/business-audit.md",
      "sha256": "aaaaaaaaaaaaaaaaaaaaaaaaaaaaaaaaaaaaaaaaaaaaaaaaaaaaaaaaaaaaaaaa"
    },
    "authenticatedSessionVerified": true,
    "dynamicResourcesVerified": true,
    "owner": "fixture-owner",
    "reviewedAt": "2026-08-14T00:00:00.000Z",
    "targetOrigin": "https://example.invalid",
    "transportDecision": "post-message"
  },
  "decision": {
    "adr": {
      "path": "evidence/m0-decision.md",
      "sha256": "bbbbbbbbbbbbbbbbbbbbbbbbbbbbbbbbbbbbbbbbbbbbbbbbbbbbbbbbbbbbbbbb"
    },
    "decidedAt": "2026-08-14T00:00:00.000Z",
    "reviewers": ["fixture-reviewer"],
    "status": "go"
  },
  "devices": [
    {
      "batchIds": ["10000000-0000-4000-8000-000000000001", "10000000-0000-4000-8000-000000000002"],
      "browserVersion": "Fixture Browser 1",
      "capabilities": {
        "crossOriginIsolated": false,
        "editContext": false,
        "workerOffscreenCanvas": true,
        "sharedArrayBuffer": false,
        "workerRaf": true
      },
      "deviceId": "android-low-01",
      "devicePixelRatio": 2,
      "displayScale": 1,
      "fontScale": 1,
      "inputMethods": ["Fixture IME 1"],
      "manufacturerModel": "Fixture Android Low",
      "memoryGiB": 4,
      "osBuild": "Fixture OS 1",
      "owner": "fixture-owner",
      "physical": true,
      "powerProfile": "balanced",
      "refreshRateHz": 60,
      "roleId": "android-low",
      "soc": "Fixture SoC Low",
      "storageFreeGiB": 16,
      "temperatureRangeC": { "maximum": 38, "minimum": 20 },
      "viewport": { "height": 800, "width": 360 }
    },
    {
      "batchIds": ["20000000-0000-4000-8000-000000000001", "20000000-0000-4000-8000-000000000002"],
      "browserVersion": "Fixture Browser 1",
      "capabilities": {
        "crossOriginIsolated": true,
        "editContext": true,
        "workerOffscreenCanvas": true,
        "sharedArrayBuffer": true,
        "workerRaf": true
      },
      "deviceId": "android-mid-01",
      "devicePixelRatio": 3,
      "displayScale": 1,
      "fontScale": 1,
      "inputMethods": ["Fixture IME 1"],
      "manufacturerModel": "Fixture Android Mid",
      "memoryGiB": 8,
      "osBuild": "Fixture OS 1",
      "owner": "fixture-owner",
      "physical": true,
      "powerProfile": "balanced",
      "refreshRateHz": 60,
      "roleId": "android-mid",
      "soc": "Fixture SoC Mid",
      "storageFreeGiB": 32,
      "temperatureRangeC": { "maximum": 38, "minimum": 20 },
      "viewport": { "height": 900, "width": 412 }
    },
    {
      "batchIds": ["30000000-0000-4000-8000-000000000001", "30000000-0000-4000-8000-000000000002"],
      "browserVersion": "Fixture Chromium 1",
      "capabilities": {
        "crossOriginIsolated": true,
        "editContext": true,
        "workerOffscreenCanvas": true,
        "sharedArrayBuffer": true,
        "workerRaf": true
      },
      "deviceId": "desktop-shared-01",
      "devicePixelRatio": 2,
      "displayScale": 1,
      "fontScale": 1,
      "inputMethods": ["Fixture IME 1"],
      "manufacturerModel": "Fixture Desktop",
      "memoryGiB": 16,
      "osBuild": "Fixture Desktop OS 1",
      "owner": "fixture-owner",
      "physical": true,
      "powerProfile": "ac",
      "refreshRateHz": 60,
      "roleId": "desktop-chromium",
      "soc": "Fixture Desktop SoC",
      "storageFreeGiB": 100,
      "temperatureRangeC": { "maximum": 35, "minimum": 20 },
      "viewport": { "height": 900, "width": 1440 }
    },
    {
      "batchIds": ["40000000-0000-4000-8000-000000000001", "40000000-0000-4000-8000-000000000002"],
      "browserVersion": "Fixture Firefox 1",
      "capabilities": {
        "crossOriginIsolated": false,
        "editContext": false,
        "workerOffscreenCanvas": true,
        "sharedArrayBuffer": false,
        "workerRaf": false
      },
      "deviceId": "desktop-shared-01",
      "devicePixelRatio": 2,
      "displayScale": 1,
      "fontScale": 1,
      "inputMethods": ["Fixture IME 1"],
      "manufacturerModel": "Fixture Desktop",
      "memoryGiB": 16,
      "osBuild": "Fixture Desktop OS 1",
      "owner": "fixture-owner",
      "physical": true,
      "powerProfile": "ac",
      "refreshRateHz": 60,
      "roleId": "desktop-firefox",
      "soc": "Fixture Desktop SoC",
      "storageFreeGiB": 100,
      "temperatureRangeC": { "maximum": 35, "minimum": 20 },
      "viewport": { "height": 900, "width": 1440 }
    },
    {
      "batchIds": ["50000000-0000-4000-8000-000000000001", "50000000-0000-4000-8000-000000000002"],
      "browserVersion": "Fixture Safari 1",
      "capabilities": {
        "crossOriginIsolated": false,
        "editContext": false,
        "workerOffscreenCanvas": false,
        "sharedArrayBuffer": false,
        "workerRaf": false
      },
      "deviceId": "desktop-shared-01",
      "devicePixelRatio": 2,
      "displayScale": 1,
      "fontScale": 1,
      "inputMethods": ["Fixture IME 1"],
      "manufacturerModel": "Fixture Desktop",
      "memoryGiB": 16,
      "osBuild": "Fixture Desktop OS 1",
      "owner": "fixture-owner",
      "physical": true,
      "powerProfile": "ac",
      "refreshRateHz": 60,
      "roleId": "desktop-safari",
      "soc": "Fixture Desktop SoC",
      "storageFreeGiB": 100,
      "temperatureRangeC": { "maximum": 35, "minimum": 20 },
      "viewport": { "height": 900, "width": 1440 }
    },
    {
      "batchIds": ["60000000-0000-4000-8000-000000000001", "60000000-0000-4000-8000-000000000002"],
      "browserVersion": "Fixture Safari 1",
      "capabilities": {
        "crossOriginIsolated": false,
        "editContext": false,
        "workerOffscreenCanvas": false,
        "sharedArrayBuffer": false,
        "workerRaf": false
      },
      "deviceId": "ios-baseline-01",
      "devicePixelRatio": 2,
      "displayScale": 1,
      "fontScale": 1,
      "inputMethods": ["Fixture iOS IME 1"],
      "manufacturerModel": "Fixture iPhone Baseline",
      "memoryGiB": 4,
      "osBuild": "Fixture iOS 1",
      "owner": "fixture-owner",
      "physical": true,
      "powerProfile": "battery",
      "refreshRateHz": 60,
      "roleId": "ios-baseline",
      "soc": "Fixture iOS SoC",
      "storageFreeGiB": 16,
      "temperatureRangeC": { "maximum": 38, "minimum": 20 },
      "viewport": { "height": 844, "width": 390 }
    },
    {
      "batchIds": ["70000000-0000-4000-8000-000000000001", "70000000-0000-4000-8000-000000000002"],
      "browserVersion": "Fixture Safari 2",
      "capabilities": {
        "crossOriginIsolated": false,
        "editContext": true,
        "workerOffscreenCanvas": true,
        "sharedArrayBuffer": false,
        "workerRaf": true
      },
      "deviceId": "ios-current-01",
      "devicePixelRatio": 3,
      "displayScale": 1,
      "fontScale": 1,
      "inputMethods": ["Fixture iOS IME 2"],
      "manufacturerModel": "Fixture iPhone Current",
      "memoryGiB": 8,
      "osBuild": "Fixture iOS 2",
      "owner": "fixture-owner",
      "physical": true,
      "powerProfile": "battery",
      "refreshRateHz": 120,
      "roleId": "ios-current",
      "soc": "Fixture iOS SoC Current",
      "storageFreeGiB": 64,
      "temperatureRangeC": { "maximum": 38, "minimum": 20 },
      "viewport": { "height": 932, "width": 430 }
    }
  ],
  "storage": {
    "artifact": {
      "path": "evidence/storage-retention.md",
      "sha256": "cccccccccccccccccccccccccccccccccccccccccccccccccccccccccccccccc"
    },
    "backend": "fixture immutable object storage",
    "backupVerifiedAt": "2026-08-14T00:00:00.000Z",
    "immutable": true,
    "offDevice": true,
    "owner": "fixture-owner",
    "restoreVerifiedAt": "2026-08-14T00:00:00.000Z",
    "retentionDays": 90
  }
}
